"2024002992684MACAO DE COND JACUIPE LTDA ME","CANDEIAS"
"A L S FORMACAO DE CONDUTORES LTDA ME","MUCURI"
"A L S FORMACAO DE CONDUTORES LTDA ME","NOVA VICOSA"
"ABB CENTRO DE FORMACAO DE CONDUTORES LTDA ME","SALVADOR"
"ADRIANO FERNANDES SANTOS ME","POJUCA"
"ADRIEL DO NASCIMENTO","MONTE SANTO"
"ANGELO MARCIO PEREIRA ME","VITORIA DA CONQUISTA"
"ANTONIO JOSE LEITE & CIA LTDA","SANTO ANTONIO DE JESUS"
"ANTONIO JOSE LEITE & CIA LTDA","VERA CRUZ"
"AUTO ESCOLA AMORIM LTDA ME","FEIRA DE SANTANA"
"AUTO ESCOLA BARREIRAS LTDA ME","SALVADOR"
"AUTO ESCOLA BONCONSELHO LTDA ME","CICERO DANTAS"
"AUTO ESCOLA BRASIL LTDA ME","SALVADOR"
"AUTO ESCOLA CANDEIAS LTDA ME","CANDEIAS"
"AUTO ESCOLA CARINHANHA LTDA","CARINHANHA"
"AUTO ESCOLA EDUCAR BRASIL LTDA-ME","SERRINHA"
"AUTO ESCOLA GAMA LTDA ME","MUCURI"
"AUTO ESCOLA GIRASSOL LTDA","CACHOEIRA"
"AUTO ESCOLA GUAIBIM LTDA","VALENCA"
"AUTO ESCOLA GUANAMBI LTDA ME","GUANAMBI"
"AUTO ESCOLA HABILITAR LTDA ME","SENHOR DO BONFIM"
"AUTO ESCOLA KADOSH LTDA","POCOES"
"AUTO ESCOLA LAPAO LTDA ME","LAPAO"
"AUTO ESCOLA MILAGRE LTDA","SALVADOR"
"AUTO ESCOLA NASCIMENTO SOUZA LTDA-ME","OLINDINA"
"AUTO ESCOLA ONIX COARACI LTDA ME","COARACI"
"AUTO ESCOLA PARAGUASSU LTDA ME","SANTO ESTEVAO"
"AUTO ESCOLA PARAISO LTDA ME","CATU"
"AUTO ESCOLA PARAISO LTDA ME","SAO SEBASTIAO DO PASSE"
"AUTO ESCOLA PROGRESSO CENTRO DE FORM DE COND LTDA","CAMACARI"
"AUTO ESCOLA RENASCER EIRELI ME","SALVADOR"
"AUTO ESCOLA RIBEIRO SILVA LTDA ME","TEIXEIRA DE FREITAS"
"AUTO ESCOLA SANTA LUZIA LTDA","SANTALUZ"
"AUTO ESCOLA SANTIAGO SILVA LTDA","JEQUIE"
"AUTO ESCOLA SAO SEBASTIAO LTDA","SAO SEBASTIAO DO PASSE"
"AUTO ESCOLA SINAL VERDE ILHEUS LTDA ME","ILHEUS"
"AUTO ESCOLA SUDOESTE LTDA ME","VITORIA DA CONQUISTA"
"AUTO ESCOLA TEIXEIRA DE ALCOBACA LTDA ME","ALCOBACA"
"AUTO ESCOLA TEIXEIRA DE ITANHEM LTDA ME","ITANHEM"
"AUTO ESCOLA TEIXEIRA EIRELI","TEIXEIRA DE FREITAS"
"AUTO ESCOLA TRES ESTRELAS LTDA ME","SALVADOR"
"AUTO ESCOLA VOLANTE LTDA ME","IBIPITANGA"
"AUTO ESCOLA VOLANTE LTDA ME","IBITIARA"
"AUTO ESCOLA VOLANTE LTDA ME","MACAUBAS"
"AUTO ESCOLA VOLANTE LTDA ME","OLIVEIRA DOS BREJINHOS"
"AUTO ESCOLA XIQUE-XIQUE LTDA ME","XIQUE XIQUE"
"AUTOVIA E DESENVOLVIMENTO LTDA","MEDEIROS NETO"
"AUTOVIA E DESENVOLVIMENTO LTDA ME","TEIXEIRA DE FREITAS"
"BRANDAO SANTOS FORMACAO DE CONDUTORES LTDA ME","ILHEUS"
"BRANDAO SANTOS FORMACAO DE CONDUTORES LTDA ME","IPIAU"
"BRANDAO SANTOS FORMACAO DE CONDUTORES LTDA ME","UBATA"
"BRITO E VAZ LTDA ME","ITAPETINGA"
"C DE FORM DE CONDUTORES MAGALHAES NOVAIS LTDA ME","BOM JESUS DA LAPA"
"C DE FORMACAO DE CONDUTORES CUSTODIO DAVID LTDA","CONDEUBA"
"C DE FORMACAO DE CONDUTORES CUSTODIO DAVID LTDA","MORTUGABA"
"C DE FORMACAO DE CONDUTORES NOVA ESCOLA MODELO LTD","JUAZEIRO"
"C DE FORMACAO DE CONDUTORES NOVO HORIZONTE LTDA ME","SALVADOR"
"C F C APOLLO LTDA ME","GUANAMBI"
"C.S.P CENTRO DE FORMACAO DE CONDUTORES LTDA","EUCLIDES DA CUNHA"
"C.S.P CENTRO DE FORMACAO DE CONDUTORES LTDA","MUTUIPE"
"C.S.P CENTRO DE FORMACAO DE CONDUTORES LTDA","UBAITABA"
"CARVALHO GARCIA & CIA LTDA","SIMOES FILHO"
"CENT DE FORM DE COND OESTE SAMAVI LTDA","SANTA MARIA DA VITORIA"
"CENT DE FORM DE CONDUTORES JOAQUIM ROMAO LTDA ME","JEQUIE"
"CENT DE FORM DE CONDUTORES TRANSITO LIVRE LTDA ME","SALVADOR"
"CENT FORM DE COND AUTOM LIDERANCA POSITIVA LTDA ME","FEIRA DE SANTANA"
"CENTDEFORM DE CONDUT AUTOMOTIVOS JOTA JOTA LTDA-ME","FEIRA DE SANTANA"
"CENTREINE CENTRO DE FORMACAO DE CONDUTORES LTDA","ARACI"
"CENTRO DE F DE C DE VECULOS ALBUQUERQUE LTDA ME","PAULO AFONSO"
"CENTRO DE F DE C OESTE DE BOM JESUS DA LAPA LTDAME","BOM JESUS DA LAPA"
"CENTRO DE F DE COND NOVA HABILITE SE LTDA ME","SALVADOR"
"CENTRO DE F DE CONDUTORES METROPOLITANO EIRELI","CAMACARI"
"CENTRO DE F E REQUALIFICACAO DE C DE V SHANNA LTDA","ITAMARAJU"
"CENTRO DE F.DE CONDUTORES MOV E TRANSITO LTDA ME","BARREIRAS"
"CENTRO DE FOR DE COND TRANSCURSOS SALVADOR LTDA","SALVADOR"
"CENTRO DE FOR DE CONDUTORES MARIA QUITERIA LTDA ME","FEIRA DE SANTANA"
"CENTRO DE FOR DE CONDUTORES SANTO ANTONIO  LTDA","MUTUIPE"
"CENTRO DE FOR DE CONDUTORES SANTO ANTONIO LTDA ME","SANTO ANTONIO DE JESUS"
"CENTRO DE FORM DE COND DO NORDESTE DA BAHIA LTDAME","PAULO AFONSO"
"CENTRO DE FORM DE COND SAO GONCALO DOS CAMPOS LTDA","CONCEICAO DA FEIRA"
"CENTRO DE FORM DE COND SAO SALVADOR LTDA ME","SALVADOR"
"CENTRO DE FORM DE CONDUTORES FIUZA LTDA ME","SERRINHA"
"CENTRO DE FORM DE CONDUTORES JUAZEIRO LTDA","JUAZEIRO"
"CENTRO DE FORM DE CONDUTORES MAIS AMIGOS LTDA-ME","SANTO ANTONIO DE JESUS"
"CENTRO DE FORM DE CONDUTORES NOVA FATIMA EIRELI ME","NOVA FATIMA"
"CENTRO DE FORM DE CONDUTORES NOVA IDEIA LTDA ME","CAMACARI"
"CENTRO DE FORM DE CONDUTORES SAO GONCALO LTDA ME","SAO GONCALO DOS CAMPOS"
"CENTRO DE FORM DE CONDUTORES SO PRA ELAS LTDA ME","FEIRA DE SANTANA"
"CENTRO DE FORM DE CONDUTORES TUCANO LTDA ME","TUCANO"
"CENTRO DE FORM DE CONDUTSUPER NOVA CONQUISTALTDAME","CANDIDO SALES"
"CENTRO DE FORMAC DE COND PARAISO REGIONAL LTDA ME","CONCEICAO DO JACUIPE"
"CENTRO DE FORMACAO COND IMPERIO RODAS LTDA ME","FEIRA DE SANTANA"
"CENTRO DE FORMACAO CONDUTORES EQUILIBRIO LTDA","SALVADOR"
"CENTRO DE FORMACAO DE C SAO CRISTOVAO LTDA ME","BRUMADO"
"CENTRO DE FORMACAO DE CON DESCOBRIMENTO LTDA","PORTO SEGURO"
"CENTRO DE FORMACAO DE COND AB SAO PEDRO LTDA ME","ITORORO"
"CENTRO DE FORMACAO DE COND ANTAS BA LTDA","ANTAS"
"CENTRO DE FORMACAO DE COND CACHOEIRA LTDA","CACHOEIRA"
"CENTRO DE FORMACAO DE COND CAPIM GROSSO LTDA ME","CAPIM GROSSO"
"CENTRO DE FORMACAO DE COND CONQUISTENSE LTDA ME","VITORIA DA CONQUISTA"
"CENTRO DE FORMACAO DE COND DE IBICARAI LTDA ME","IBICARAI"
"CENTRO DE FORMACAO DE COND DE PAULO AFONSO LTDA ME","PAULO AFONSO"
"CENTRO DE FORMACAO DE COND DEFINITIVA LTDA ME","SALVADOR"
"CENTRO DE FORMACAO DE COND EXTREMO SUL LTDA ME LTD","TEIXEIRA DE FREITAS"
"CENTRO DE FORMACAO DE COND FORCA REGIONAL LTDA ME","CAMACAN"
"CENTRO DE FORMACAO DE COND FORMULA LTDA","BRUMADO"
"CENTRO DE FORMACAO DE COND MAIA E MOREIRA LTDA ME","FEIRA DE SANTANA"
"CENTRO DE FORMACAO DE COND MASTER LTDA ME","JIQUIRICA"
"CENTRO DE FORMACAO DE COND MIRIONEI ISIS LTDA ME","SALVADOR"
"CENTRO DE FORMACAO DE COND NOVA AUTOLEM LTDA ME","BARREIRAS"
"CENTRO DE FORMACAO DE COND NOVA EQUILIBRIO LTDA","SALVADOR"
"CENTRO DE FORMACAO DE COND POSTO DA MATA LTDA","NOVA VICOSA"
"CENTRO DE FORMACAO DE COND PREFERENCIA LTDA","SALVADOR"
"CENTRO DE FORMACAO DE COND RUY BARBOSA LTDA ME","RUY BARBOSA"
"CENTRO DE FORMACAO DE COND SANTA MARIA LTDA ME","CORRENTINA"
"CENTRO DE FORMACAO DE COND SANTA MARIA LTDA ME","SANTA MARIA DA VITORIA"
"CENTRO DE FORMACAO DE COND SANTA MARIA LTDA ME","TABOCAS DO BREJO VELHO"
"CENTRO DE FORMACAO DE COND SANTOS SANTOS LTDA ME","SALVADOR"
"CENTRO DE FORMACAO DE COND SENTIDO LTDA","MATA DE SAO JOAO"
"CENTRO DE FORMACAO DE COND SINAL VERDE LTDA ME","FEIRA DE SANTANA"
"CENTRO DE FORMACAO DE COND VALE RIO DAS CONTASLTDA","IPIAU"
"CENTRO DE FORMACAO DE CONDUDORES REALIZA LTDA","SAO FELIPE"
"CENTRO DE FORMACAO DE CONDUT SIMOES FILHO LTDA ME","SIMOES FILHO"
"CENTRO DE FORMACAO DE CONDUTORES ABRANTES LTDA","SALVADOR"
"CENTRO DE FORMACAO DE CONDUTORES ACAO LTDA ME","SALVADOR"
"CENTRO DE FORMACAO DE CONDUTORES AGORA LTDA","SALVADOR"
"CENTRO DE FORMACAO DE CONDUTORES AGUIA LTDA ME","BARREIRAS"
"CENTRO DE FORMACAO DE CONDUTORES ALFA LTDA ME","VITORIA DA CONQUISTA"
"CENTRO DE FORMACAO DE CONDUTORES ALH LTDA","LAURO DE FREITAS"
"CENTRO DE FORMACAO DE CONDUTORES ALIANCA LTDA ME","SALVADOR"
"CENTRO DE FORMACAO DE CONDUTORES ALN LTDA","LAURO DE FREITAS"
"CENTRO DE FORMACAO DE CONDUTORES ALPHAVILLE LTDA","SALVADOR"
"CENTRO DE FORMACAO DE CONDUTORES ALTO PADRAO LTDA","CONCEICAO DO COITE"
"CENTRO DE FORMACAO DE CONDUTORES ALTO PADRAO LTDA","SANTALUZ"
"CENTRO DE FORMACAO DE CONDUTORES AMARALINA LTDA","SALVADOR"
"CENTRO DE FORMACAO DE CONDUTORES ANDRADE LTDA ME","JACOBINA"
"CENTRO DE FORMACAO DE CONDUTORES ANGELO LTDA-ME","SALVADOR"
"CENTRO DE FORMACAO DE CONDUTORES ANGELUS LTDA ME","CAMACARI"
"CENTRO DE FORMACAO DE CONDUTORES APRENDIZ LTDA","ITAGIMIRIM"
"CENTRO DE FORMACAO DE CONDUTORES APROVADO LTDA","SALVADOR"
"CENTRO DE FORMACAO DE CONDUTORES AREMBEPE LTDA ME","CAMACARI"
"CENTRO DE FORMACAO DE CONDUTORES ATITUDE LTDA ME","SALVADOR"
"CENTRO DE FORMACAO DE CONDUTORES BELMONTE LTDA ME","SALVADOR"
"CENTRO DE FORMACAO DE CONDUTORES BLITZ LTDA ME","SALVADOR"
"CENTRO DE FORMACAO DE CONDUTORES BOM JESUS LTDA ME","SAO FELIX DO CORIBE"
"CENTRO DE FORMACAO DE CONDUTORES BRUMADO LTDA ME","BARRA DA ESTIVA"
"CENTRO DE FORMACAO DE CONDUTORES BRUMADO LTDA ME","BRUMADO"
"CENTRO DE FORMACAO DE CONDUTORES BURANHEM LTDA ME","PORTO SEGURO"
"CENTRO DE FORMACAO DE CONDUTORES CABRALIA LTDA ME","PORTO SEGURO"
"CENTRO DE FORMACAO DE CONDUTORES CABRALIA LTDA ME","SANTA CRUZ CABRALIA"
"CENTRO DE FORMACAO DE CONDUTORES CACULE LTDA MEA","CACULE"
"CENTRO DE FORMACAO DE CONDUTORES CALEMBA LTDA-ME","CANDEIAS"
"CENTRO DE FORMACAO DE CONDUTORES CALEMBA LTDA-ME","SIMOES FILHO"
"CENTRO DE FORMACAO DE CONDUTORES CAMACAN LTDA","CAMACAN"
"CENTRO DE FORMACAO DE CONDUTORES CAMACARI LTDA ME","CAMACARI"
"CENTRO DE FORMACAO DE CONDUTORES CAMACARI LTDA ME","DIAS D AVILA"
"CENTRO DE FORMACAO DE CONDUTORES CAMAMU LTDA ME","CAMAMU"
"CENTRO DE FORMACAO DE CONDUTORES CAMILA LTDA ME","BARREIRAS"
"CENTRO DE FORMACAO DE CONDUTORES CAPACITAR LTDA-ME","EUNAPOLIS"
"CENTRO DE FORMACAO DE CONDUTORES CARINHANHA","CARINHANHA"
"CENTRO DE FORMACAO DE CONDUTORES CASA NOVA LTDA-ME","FEIRA DE SANTANA"
"CENTRO DE FORMACAO DE CONDUTORES CATU LTDA ME","CATU"
"CENTRO DE FORMACAO DE CONDUTORES CATUENSE LTDA ME","CATU"
"CENTRO DE FORMACAO DE CONDUTORES CENTRAL TX LTDAME","TEIXEIRA DE FREITAS"
"CENTRO DE FORMACAO DE CONDUTORES CENTRAN LTDA","JEQUIE"
"CENTRO DE FORMACAO DE CONDUTORES CEPAUTO LTDA-ME","SALVADOR"
"CENTRO DE FORMACAO DE CONDUTORES CERRADO LTDA ME","LUIS EDUARDO MAGALHAES"
"CENTRO DE FORMACAO DE CONDUTORES CFC ANDER LTDA","SALVADOR"
"CENTRO DE FORMACAO DE CONDUTORES CH BOMFIM LTDA","IRAQUARA"
"CENTRO DE FORMACAO DE CONDUTORES CHARLES LTDA-ME","BARRA"
"CENTRO DE FORMACAO DE CONDUTORES CHARLES LTDA-ME","IRECE"
"CENTRO DE FORMACAO DE CONDUTORES COITE LTDA","CONCEICAO DO COITE"
"CENTRO DE FORMACAO DE CONDUTORES CONFIANCA LTDA ME","SANTO ANTONIO DE JESUS"
"CENTRO DE FORMACAO DE CONDUTORES CONQUISTA LTDA","VITORIA DA CONQUISTA"
"CENTRO DE FORMACAO DE CONDUTORES CORSARIO LTDA-ME","SALVADOR"
"CENTRO DE FORMACAO DE CONDUTORES DA ILHA LTDA","VERA CRUZ"
"CENTRO DE FORMACAO DE CONDUTORES DA VILA LTDA ME","FEIRA DE SANTANA"
"CENTRO DE FORMACAO DE CONDUTORES DE CONCEICAO LTDA","CONCEICAO DA FEIRA"
"CENTRO DE FORMACAO DE CONDUTORES DE ILHEUS LTDA","ILHEUS"
"CENTRO DE FORMACAO DE CONDUTORES DE IRECE LTDA ME","IRECE"
"CENTRO DE FORMACAO DE CONDUTORES DE ITABERABA LTDA","ITABERABA"
"CENTRO DE FORMACAO DE CONDUTORES DE V RIOS LTDA","CAPIM GROSSO"
"CENTRO DE FORMACAO DE CONDUTORES DIFERENCIALLTDAME","BRUMADO"
"CENTRO DE FORMACAO DE CONDUTORES DINAMICA","FEIRA DE SANTANA"
"CENTRO DE FORMACAO DE CONDUTORES DINAMICA LTDA ME","SANTO ESTEVAO"
"CENTRO DE FORMACAO DE CONDUTORES DINAMUS LTDA ME","SALVADOR"
"CENTRO DE FORMACAO DE CONDUTORES DIRETRIZ LTDA ME","OUROLANDIA"
"CENTRO DE FORMACAO DE CONDUTORES DIRETRIZ LTDA ME","RIACHAO DO JACUIPE"
"CENTRO DE FORMACAO DE CONDUTORES DIRIGIR LTDA ME","PORTO SEGURO"
"CENTRO DE FORMACAO DE CONDUTORES DIRIJA BEMLTDA-ME","SALVADOR"
"CENTRO DE FORMACAO DE CONDUTORES DISTAK LTDA ME","EUNAPOLIS"
"CENTRO DE FORMACAO DE CONDUTORES DO SERTAO LTDA ME","IRECE"
"CENTRO DE FORMACAO DE CONDUTORES DOMINIO LTDA ME","FEIRA DE SANTANA"
"CENTRO DE FORMACAO DE CONDUTORES DUBAY LTDA","BAIANOPOLIS"
"CENTRO DE FORMACAO DE CONDUTORES EDUCAR LTDA","JEQUIE"
"CENTRO DE FORMACAO DE CONDUTORES ENTRE RIOS LTDAME","ENTRE RIOS"
"CENTRO DE FORMACAO DE CONDUTORES EOS LTDA","REMANSO"
"CENTRO DE FORMACAO DE CONDUTORES ERA NOVA LTDA ME","SALVADOR"
"CENTRO DE FORMACAO DE CONDUTORES ESPLANADA LTDA-ME","ESPLANADA"
"CENTRO DE FORMACAO DE CONDUTORES ESTRELA LTDA ME","SANTO AMARO"
"CENTRO DE FORMACAO DE CONDUTORES ETEBA LTDA ME","BAIXA GRANDE"
"CENTRO DE FORMACAO DE CONDUTORES ETEBA LTDA ME","IPIRA"
"CENTRO DE FORMACAO DE CONDUTORES ETEBA LTDA ME","SALVADOR"
"CENTRO DE FORMACAO DE CONDUTORES EUNAPORTO LTDA","CANAVIEIRAS"
"CENTRO DE FORMACAO DE CONDUTORES EUNAPORTO LTDA","EUNAPOLIS"
"CENTRO DE FORMACAO DE CONDUTORES EXODO LTDA","SANTA BARBARA"
"CENTRO DE FORMACAO DE CONDUTORES EXPERT LTDA ME","VITORIA DA CONQUISTA"
"CENTRO DE FORMACAO DE CONDUTORES EXPRESSO 21LTDAME","IBICARAI"
"CENTRO DE FORMACAO DE CONDUTORES FANTASTICA LTDA","SALVADOR"
"CENTRO DE FORMACAO DE CONDUTORES FARIAS BASTOS LTD","ILHEUS"
"CENTRO DE FORMACAO DE CONDUTORES FEIRENSE LTDA ME","FEIRA DE SANTANA"
"CENTRO DE FORMACAO DE CONDUTORES FERRARI LTDA ME","BARREIRAS"
"CENTRO DE FORMACAO DE CONDUTORES FONTES LTDA ME","SALVADOR"
"CENTRO DE FORMACAO DE CONDUTORES FORMOSA LTDA ME","FORMOSA DO RIO PRETO"
"CENTRO DE FORMACAO DE CONDUTORES FORMULA 7 LTDA ME","VITORIA DA CONQUISTA"
"CENTRO DE FORMACAO DE CONDUTORES FR LTDA ME","AMARGOSA"
"CENTRO DE FORMACAO DE CONDUTORES FUTURA LTDA","ITABUNA"
"CENTRO DE FORMACAO DE CONDUTORES FUTURA LTDA ME","EUNAPOLIS"
"CENTRO DE FORMACAO DE CONDUTORES GAVIAO LTDA","LAURO DE FREITAS"
"CENTRO DE FORMACAO DE CONDUTORES GLORIA LTDA ME","SALVADOR"
"CENTRO DE FORMACAO DE CONDUTORES GRIFFO LTDA ME","NOVA VICOSA"
"CENTRO DE FORMACAO DE CONDUTORES HABILITY LTDA-ME","SIMOES FILHO"
"CENTRO DE FORMACAO DE CONDUTORES HARMONIA LTDA ME","JUAZEIRO"
"CENTRO DE FORMACAO DE CONDUTORES HBS LTDA ME","ITAPETINGA"
"CENTRO DE FORMACAO DE CONDUTORES IDEAL LTDA ME","CANDEIAS"
"CENTRO DE FORMACAO DE CONDUTORES IGUATEMI LTDA","SALVADOR"
"CENTRO DE FORMACAO DE CONDUTORES IMPERIO LTDA","LUIS EDUARDO MAGALHAES"
"CENTRO DE FORMACAO DE CONDUTORES IPIRA LTDA ME","IPIRA"
"CENTRO DE FORMACAO DE CONDUTORES IRARA LTDA ME","IRARA"
"CENTRO DE FORMACAO DE CONDUTORES ITABELA LTDA ME","ITABELA"
"CENTRO DE FORMACAO DE CONDUTORES ITACARE LTDA ME","ITACARE"
"CENTRO DE FORMACAO DE CONDUTORES ITAMARAJU LTDA","ITAMARAJU"
"CENTRO DE FORMACAO DE CONDUTORES ITINGA LTDA","LAURO DE FREITAS"
"CENTRO DE FORMACAO DE CONDUTORES ITIUBA LTDA","ITIUBA"
"CENTRO DE FORMACAO DE CONDUTORES JACANA LTDA","ITABUNA"
"CENTRO DE FORMACAO DE CONDUTORES JACOBINA LTDA ME","JACOBINA"
"CENTRO DE FORMACAO DE CONDUTORES JAGUAR LTDA ME","JAGUAQUARA"
"CENTRO DE FORMACAO DE CONDUTORES JAGUARARI LTDA","JAGUARARI"
"CENTRO DE FORMACAO DE CONDUTORES JOAO PAULO LTDAME","FEIRA DE SANTANA"
"CENTRO DE FORMACAO DE CONDUTORES JUCURUCU LTDA-ME","JUCURUCU"
"CENTRO DE FORMACAO DE CONDUTORES KARYS 10 LTDA","SAPEACU"
"CENTRO DE FORMACAO DE CONDUTORES KARYS LTDA","CACHOEIRA"
"CENTRO DE FORMACAO DE CONDUTORES KARYS LTDA","CASTRO ALVES"
"CENTRO DE FORMACAO DE CONDUTORES KARYS LTDA","CRUZ DAS ALMAS"
"CENTRO DE FORMACAO DE CONDUTORES KILOMETRO LTDA ME","PORTO SEGURO"
"CENTRO DE FORMACAO DE CONDUTORES L SANTOS LTDA","UBAITABA"
"CENTRO DE FORMACAO DE CONDUTORES LAURO DE FREITAS","LAURO DE FREITAS"
"CENTRO DE FORMACAO DE CONDUTORES LIBERDADE LTDA ME","FEIRA DE SANTANA"
"CENTRO DE FORMACAO DE CONDUTORES LIMA LTDA","ITAMARAJU"
"CENTRO DE FORMACAO DE CONDUTORES LUC'AUTO LTDA ME","EUCLIDES DA CUNHA"
"CENTRO DE FORMACAO DE CONDUTORES LUZ LTDA","FEIRA DE SANTANA"
"CENTRO DE FORMACAO DE CONDUTORES MACLAREN LTDA ME","BARREIRAS"
"CENTRO DE FORMACAO DE CONDUTORES MACLAREN LTDA ME","LUIS EDUARDO MAGALHAES"
"CENTRO DE FORMACAO DE CONDUTORES MARACAS LTDA","MARACAS"
"CENTRO DE FORMACAO DE CONDUTORES MARIA LTDA EPP","LAURO DE FREITAS"
"CENTRO DE FORMACAO DE CONDUTORES MARINA LTDA ME","SAO FELIX DO CORIBE"
"CENTRO DE FORMACAO DE CONDUTORES MASTER LTDA ME","LIVRAMENTO DE NOSSA SENHORA"
"CENTRO DE FORMACAO DE CONDUTORES MIL MILHAS LTDAME","PORTO SEGURO"
"CENTRO DE FORMACAO DE CONDUTORES MINININHO LTDA ME","FEIRA DE SANTANA"
"CENTRO DE FORMACAO DE CONDUTORES MOACIR LTDA ME","BRUMADO"
"CENTRO DE FORMACAO DE CONDUTORES MODELO LTDA-ME","CAETITE"
"CENTRO DE FORMACAO DE CONDUTORES MODELO LTDA-ME","VITORIA DA CONQUISTA"
"CENTRO DE FORMACAO DE CONDUTORES MODERNA LTDA ME","GUANAMBI"
"CENTRO DE FORMACAO DE CONDUTORES MOURA LTDA ME","TEIXEIRA DE FREITAS"
"CENTRO DE FORMACAO DE CONDUTORES MUNDIAL LTDA ME","FEIRA DE SANTANA"
"CENTRO DE FORMACAO DE CONDUTORES MUNDO NOVO LTDA","MUNDO NOVO"
"CENTRO DE FORMACAO DE CONDUTORES MWM LTDA ME","SALVADOR"
"CENTRO DE FORMACAO DE CONDUTORES NATIVA LTDA ME","BARREIRAS"
"CENTRO DE FORMACAO DE CONDUTORES NAVEGANTES LTDA","PORTO SEGURO"
"CENTRO DE FORMACAO DE CONDUTORES NAZARETH LTDA ME","NAZARE"
"CENTRO DE FORMACAO DE CONDUTORES NOBRE LTDA","RIBEIRA DO POMBAL"
"CENTRO DE FORMACAO DE CONDUTORES NOTA 10 LTDA-ME","SALVADOR"
"CENTRO DE FORMACAO DE CONDUTORES NOVA DIRECAO LTDA","SALVADOR"
"CENTRO DE FORMACAO DE CONDUTORES NOVA IDEIA EIRELI","SANTO ESTEVAO"
"CENTRO DE FORMACAO DE CONDUTORES NOVA OPCAO LTDA","SALVADOR"
"CENTRO DE FORMACAO DE CONDUTORES O GLOBO LTDA","JUAZEIRO"
"CENTRO DE FORMACAO DE CONDUTORES OESTE LTDA ME","SANTANA"
"CENTRO DE FORMACAO DE CONDUTORES OMEGA LTDA ME","SALVADOR"
"CENTRO DE FORMACAO DE CONDUTORES OMEGA LTDA ME","SAUBARA"
"CENTRO DE FORMACAO DE CONDUTORES PADRAO LTDA-ME","SALVADOR"
"CENTRO DE FORMACAO DE CONDUTORES PEREIRA LTDA","FEIRA DE SANTANA"
"CENTRO DE FORMACAO DE CONDUTORES PERFEICAO LTDA ME","FEIRA DE SANTANA"
"CENTRO DE FORMACAO DE CONDUTORES PINHEIRO E SANTOS","ITABERABA"
"CENTRO DE FORMACAO DE CONDUTORES PIRANGY LTDA ME","ITAJUIPE"
"CENTRO DE FORMACAO DE CONDUTORES PONTA AGUDA LTDA","ITATIM"
"CENTRO DE FORMACAO DE CONDUTORES POSITIVA LTDA ME","LUIS EDUARDO MAGALHAES"
"CENTRO DE FORMACAO DE CONDUTORES PRADOTRAN LTDA ME","PRADO"
"CENTRO DE FORMACAO DE CONDUTORES PRIMUS LTDA ME","JEQUIE"
"CENTRO DE FORMACAO DE CONDUTORES PRIMVER LTDA -ME","ITABUNA"
"CENTRO DE FORMACAO DE CONDUTORES PRINCESA LTDA ME","FEIRA DE SANTANA"
"CENTRO DE FORMACAO DE CONDUTORES PRISMA LTDA ME","CRUZ DAS ALMAS"
"CENTRO DE FORMACAO DE CONDUTORES R2 LTDA ME","CRUZ DAS ALMAS"
"CENTRO DE FORMACAO DE CONDUTORES REGIONAL LTDA ME","ITABUNA"
"CENTRO DE FORMACAO DE CONDUTORES REINA LTDA ME","CACULE"
"CENTRO DE FORMACAO DE CONDUTORES RIO REAL LTDA ME","ALAGOINHAS"
"CENTRO DE FORMACAO DE CONDUTORES RPV LTDA ME","EUNAPOLIS"
"CENTRO DE FORMACAO DE CONDUTORES SALMOS LTDA ME","SALVADOR"
"CENTRO DE FORMACAO DE CONDUTORES SANTA FE LTDA ME","SALVADOR"
"CENTRO DE FORMACAO DE CONDUTORES SAO JOSE LTDA ME","ITAPETINGA"
"CENTRO DE FORMACAO DE CONDUTORES SERRINHA LTDA ME","SERRINHA"
"CENTRO DE FORMACAO DE CONDUTORES SIM LTDA","FEIRA DE SANTANA"
"CENTRO DE FORMACAO DE CONDUTORES STATUS LTDA-ME","SALVADOR"
"CENTRO DE FORMACAO DE CONDUTORES SUDOESTE LTDA ME","IGUAI"
"CENTRO DE FORMACAO DE CONDUTORES SUPER VIDA LTDAME","SALVADOR"
"CENTRO DE FORMACAO DE CONDUTORES SUPERVIA EIRELI","IRECE"
"CENTRO DE FORMACAO DE CONDUTORES TIRADENTES","SALVADOR"
"CENTRO DE FORMACAO DE CONDUTORES TOP MODELO LTDA","VITORIA DA CONQUISTA"
"CENTRO DE FORMACAO DE CONDUTORES TRANSBAHIA LTDAME","SALVADOR"
"CENTRO DE FORMACAO DE CONDUTORES TRANSITAR LTDA ME","SALVADOR"
"CENTRO DE FORMACAO DE CONDUTORES TREVO LTDA ME","ALAGOINHAS"
"CENTRO DE FORMACAO DE CONDUTORES TRINDADE LTDA ME","FEIRA DE SANTANA"
"CENTRO DE FORMACAO DE CONDUTORES TROPICAL LTDA","CONCEICAO DO JACUIPE"
"CENTRO DE FORMACAO DE CONDUTORES TROPICAL LTDA ME","CORACAO DE MARIA"
"CENTRO DE FORMACAO DE CONDUTORES TUCANENSE LTDA ME","SALVADOR"
"CENTRO DE FORMACAO DE CONDUTORES TURIM LTDA","SALVADOR"
"CENTRO DE FORMACAO DE CONDUTORES UNIAO LTDA ME","FEIRA DE SANTANA"
"CENTRO DE FORMACAO DE CONDUTORES UNIAO LTDA ME","SALVADOR"
"CENTRO DE FORMACAO DE CONDUTORES UNITRAN LTDA ME","JEQUIE"
"CENTRO DE FORMACAO DE CONDUTORES VALENCA LTDA ME","GANDU"
"CENTRO DE FORMACAO DE CONDUTORES VALENCA LTDA ME","IPIAU"
"CENTRO DE FORMACAO DE CONDUTORES VALENCA LTDA ME","ITUBERA"
"CENTRO DE FORMACAO DE CONDUTORES VALENCA LTDA ME","JEQUIE"
"CENTRO DE FORMACAO DE CONDUTORES VALENCA LTDA ME","PRESIDENTE TANCREDO NEVES"
"CENTRO DE FORMACAO DE CONDUTORES VALENCA LTDA ME","VALENCA"
"CENTRO DE FORMACAO DE CONDUTORES VALENTE EIRELI","VALENTE"
"CENTRO DE FORMACAO DE CONDUTORES VANADIO LTDA ME","MARACAS"
"CENTRO DE FORMACAO DE CONDUTORES VEJA LTDA","SALVADOR"
"CENTRO DE FORMACAO DE CONDUTORES VEJA LTDA ME","SALVADOR"
"CENTRO DE FORMACAO DE CONDUTORES VIA BRASIL LTDA","CAETITE"
"CENTRO DE FORMACAO DE CONDUTORES VIA BRASIL LTDA","RIACHO DE SANTANA"
"CENTRO DE FORMACAO DE CONDUTORES VIA EXPRESS LTDA","SALVADOR"
"CENTRO DE FORMACAO DE CONDUTORES VIA FACIL LTDA","TEIXEIRA DE FREITAS"
"CENTRO DE FORMACAO DE CONDUTORES VICENTE LTDA ME","ITABUNA"
"CENTRO DE FORMACAO DE CONDUTORES VILA MAR LTDA ME","CAMACARI"
"CENTRO DE FORMACAO DE CONDUTORES VILLAS LTDA ME","LAURO DE FREITAS"
"CENTRO DE FORMACAO DE CONDUTORES VISAO LTDA","FEIRA DE SANTANA"
"CENTRO DE FORMACAO DE CONDUTORES YONE LTDA ME","ITABUNA"
"CENTRO DE FORMACAO DE CONDUTORESPERSONNALITELTDAME","SALVADOR"
"CENTRO DE FORMACAO DE CONDUUTORES SALINAS LTDA","SALINAS DA MARGARIDA"
"CENTRO DE FORMACAO NOVA GERACAO LTDA ME","SALVADOR"
"CENTRO DE FORMACAO PARA CONDUTORES BOM SENSO LTDA","JUAZEIRO"
"CENTRO DE FORMACAODECONDUTORES HABILITE-SE LTDA-ME","SALVADOR"
"CENTRO DE FORMC DE CONDT AUTOMOTIVOS I9 LTDA ME","SANTO ANTONIO DE JESUS"
"CENTRO FORM DE COND MORRO DE SAO PAULO LTDA ME","VALENCA"
"CENTRO FORMACAO COND PORTAL DO SERTAO LTDA ME","FEIRA DE SANTANA"
"CENTRO FORMACAO CONDUTORES CANAVIEIRAS LTDA ME","CANAVIEIRAS"
"CENTRO FORMACAO DE CONDUTORES CASTRO LTDA","ITABERABA"
"CENTRODE FORMACAODE CONDUTORES AUTOLEM LTDA","LUIS EDUARDO MAGALHAES"
"CETEC CENTRO TECNOLOGICO E CAPACITACAO LTDA ME","TEIXEIRA DE FREITAS"
"CFC ALIANCA NOVA LTDA","ITATIM"
"CFC CAJAIBA LTDA-ME","SAO FRANCISCO DO CONDE"
"CFC CAPACITA TREINAMENTO LTDA ME","ALAGOINHAS"
"CFC CASA NOVA LTDA","CASA NOVA"
"CFC CENTRO DE FORMACAO DE CONDU IBOTIRAMA LTDA ME","IBOTIRAMA"
"CFC CENTRO DE FORMACAO E CAPACITACAO LTDA ME","FEIRA DE SANTANA"
"CFC DE VEICULOS AUTOMOTORES APRENDA LTDA ME","SALVADOR"
"CFC EXPRESSO LAURO DE FREITAS LTDA ME","LAURO DE FREITAS"
"CFC EXPRESSO MATA DE SAO JOAO LTDA","MATA DE SAO JOAO"
"CFC FERNANDO LIVRAMENTO LTDA ME","LIVRAMENTO DE NOSSA SENHORA"
"CFC IMPERIO CENTRO DE FORMACAO DE COND LTDA","ITABUNA"
"CFC INSTITUTO DE TECNOLOGIA DE CAMACARI LTDA ME","CAMACARI"
"CFC ITAPUA LTDA ME","SALVADOR"
"CFC JC LTDA","GUANAMBI"
"CFC JC LTDA","TANQUE NOVO"
"CFC MACAUBAS LTDA ME","MACAUBAS"
"CFC MACAUBAS LTDA ME","PARAMIRIM"
"CFC NOVA FERRARI II LTDA","SAO DESIDERIO"
"CFC NOVA OBJETIVA SERV DE FORMACAO DE COND LTDA","CASA NOVA"
"CFC NOVA VISAO LTDA ME","EUNAPOLIS"
"CFC NOVO OESTE LTDA ME","LUIS EDUARDO MAGALHAES"
"CFC PEREIRA NUNES LTDA-ME","PAULO AFONSO"
"CFC PONTO ALTO LTDA ME","SALVADOR"
"CFC PONTUAL LTDA","SANTO ANTONIO DE JESUS"
"CFC RAKELLY LTDA ME","INHAMBUPE"
"CFC REIS LTDA EPP","SALVADOR"
"CFC SANTA CECILIA LTDA","ILHEUS"
"CFC SHALON LTDA ME","VITORIA DA CONQUISTA"
"CFC TEIXEIRA DO RECONCAVO LTDA ME","SANTO ANTONIO DE JESUS"
"CFC TOP CABRALIA FORMACAO DE CONDUTORES","GUARATINGA"
"CFC TRANSCURSOS ITAPARICA LTDA","ITAPARICA"
"CG AUTO ESCOLA LTDA","CAPIM GROSSO"
"CONFIE CENTRO DE FORMACAO DE CONDUTORES LTDA ME","SALVADOR"
"COSTA ALMEIDA CENTRO DE FORM DE CONDUT LTDA EPP","LAURO DE FREITAS"
"CRIAR PROJETOS SISTEMAS E AUTOMACAO DIGITAL LTDA","SALVADOR"
"DECIMO NONO BATALHAO DE CACADORES","SALVADOR"
"DEPARTAMENTO DE EDUCACAO PARA O TRANSITO","ITABUNA"
"DIAS D AVILA CENTRO DE FORMACAO DE COND EIRELI ME","DIAS D AVILA"
"DIOLINO PINTO MONTES NETO ME","POCOES"
"DIOLINO PINTO MONTES NETO ME","VITORIA DA CONQUISTA"
"DIONICE LEITE DE SOUZA ME","LAURO DE FREITAS"
"EBT ESC BAIANA DE TECN TRANSP E TRANS LTDA ME","SALVADOR"
"ESCOLA PUBLICA DE TRANSITO","SALVADOR"
"EZANGELA GONCALVES GUIMARAES ME","MEDEIROS NETO"
"F A AUTO ESCOLA LTDA ME","MATA DE SAO JOAO"
"FABRIZIO CARVALHO CONCEICAO C F C","SENHOR DO BONFIM"
"FEIRA BAHIA CENTRO DE FORMACAO DE CONDUTORES LTDA","FEIRA DE SANTANA"
"FENIX AUTO ESCOLA E CENTRO DE F DE COND EIRELI ME","CAMACARI"
"G G MONTEIRO & CIA LTDA ME","SANTA MARIA DA VITORIA"
"HARRISON L S DA SILVA ME","JUAZEIRO"
"HUMBERTO LEAL LIMA ME","VITORIA DA CONQUISTA"
"INTER CENTRO DE FORMACAO DE CONDUTORES LTDA","LAURO DE FREITAS"
"JOAO ALVES DE OLIVEIRA DE JEREMOABO ME","JEREMOABO"
"JOAO CRISOSTEMOS M MENDES & CIA LTDA ME","JACOBINA"
"JOAO RODRIGUES DA SILVA SANTOS","XIQUE XIQUE"
"JOELMA SOUZA DE OLIVEIRA & CIA LTDA ME","SEABRA"
"JOSAFA ARNALDO DA SILVA ME","LUIS EDUARDO MAGALHAES"
"JOSE VALDEVINO DE AMORIM ME","ALAGOINHAS"
"LG CENTRO DE FORMACAO DE CONDUTORES LTDA ME","SALVADOR"
"LITORANEA CENTRO DE FORMACAO DE CONDUTORES LTDA","LAURO DE FREITAS"
"M.P BRITO CENTRO DE FORMACAO DE COND AB LTDA ME","ITARANTIM"
"MANOEL DA SILVA CARNEIRO ME","RIACHAO DO JACUIPE"
"MARCELO SILVA PIRES SOUZA EIRELI ME","MARAGOGIPE"
"MARCELO SILVA PIRES SOUZA ME","MURITIBA"
"MARCIO FRANKCLIN AMARAL SANTANA ME","CAMACARI"
"MARCO ANTONIO OLIVEIRA SANTANA EPP","SENHOR DO BONFIM"
"MARCONDE GOMES DA SILVA ME","CAMPO FORMOSO"
"MARCONDE GOMES DA SILVA ME","SAUDE"
"MATHEUS MENEZES MONTES EIRELI","PLANALTO"
"MATOS E MIRANDA LTDA","MIGUEL CALMON"
"MIRAMAR CENTRO DE FOR DE CONDUTORES LTDA ME","JACOBINA"
"MJT AUTO ESCOLA CHAPADA LTDA ME","BARRA DA ESTIVA"
"MOURA CENTRO DE FORMACAO CONDUTORES LTDA ME","FEIRA DE SANTANA"
"NAILSON FRANCA DE ANDRADE ME","AMARGOSA"
"NAKAMURA CENTRO DE FORMACAO DE COND LTDA ME","POJUCA"
"NILSON LIMA DO NASCIMENTO ME","RIBEIRA DO POMBAL"
"NILTON SOUZA DE OLIVEIRA ME","PAULO AFONSO"
"OSVALDO SOUSA OLIVEIRA E CIA LTDA","LIVRAMENTO DE NOSSA SENHORA"
"PAIS E FILHOS LTDA ME","FEIRA DE SANTANA"
"PAULO BATISTA CURI ME","CRUZ DAS ALMAS"
"PAULO DE TARSO DUARTE DE ALMEIDA ME","PAULO AFONSO"
"PAULO EDSON BISPO DE SOUZA & CIA LTDA ME","SEABRA"
"PRIMOS AUTO ESCOLA LTDA ME","LAURO DE FREITAS"
"PX CENTRO DE FORMACAO DE CONDUTORES LTDA ME","VITORIA DA CONQUISTA"
"REIS E AMORIM C DE FORMACAO DE CONDUTORES LTDA","ALAGOINHAS"
"RENNASCER AUTO ESC E CENTRO DE FORMA DE CON LTDAME","CAMACARI"
"ROBSON DOS SANTOS BRITO AUTO ESCOLA","UNA"
"RODRIGUES CENTRO DE FORMACAO DE CONDUTORES EIRELI","SANTO ANTONIO DE JESUS"
"RUBENS BARROS ME","VITORIA DA CONQUISTA"
"RUDEMBERG PEREIRA DE ANDRADE EIRELI","URUCUCA"
"RUTE MAIA BATISTA ME","CAMPO FORMOSO"
"SALES AUTO ESCOLA LTDA ME","EUNAPOLIS"
